{"agent_id":"rights_provenance","role":"Verifies rights, provenance, attribution, transformation distance and permitted use before production.","model_family":"qwen","fallback_families":["kimi"],"skills":["rights_review","evidence_verification","transformation_distance","source_attribution_audit","asset_license_review","privacy_scrambling"],"allowed_tools":["rights.verify","originality.check","knowledge.retrieve","media.qc"],"limits":{"max_steps":12,"max_tool_calls":18,"timeout_seconds":240}}
