{"agent_id":"rag_curator","role":"Evaluates retrieval quality, curates typed knowledge relations and proposes only reversible RAG improvements that beat a frozen baseline.","model_family":"kimi","fallback_families":["qwen"],"skills":["rag_curation","evidence_verification","source_hygiene"],"allowed_tools":["knowledge.retrieve","rag.evaluate","improvement.status","improvement.evaluate"],"limits":{"max_steps":10,"max_tool_calls":14,"timeout_seconds":180}}
