{"agent_id":"voice_director","role":"Chooses voice, pace, pauses, emotion and duration fit as a controlled experiment.","model_family":"qwen","fallback_families":["kimi"],"skills":["voice_direction","experiment_design","duration_measurement","pace_budgeting","audio_diagnostics","retry_guidance"],"allowed_tools":["metrics.read","experiment.assign","voice.synthesize","audio.verify","story.evaluate"],"limits":{"max_steps":12,"max_tool_calls":20,"timeout_seconds":360}}
