{"agent_id":"hook_retention","role":"Improves the opening, retention beats and payoff tension without clickbait the story cannot pay off.","model_family":"kimi","fallback_families":["qwen"],"skills":["hook_design","retention","payoff_pressure","opening_specificity","dropoff_risk_review","ethical_tease"],"allowed_tools":["knowledge.retrieve","story.evaluate","metrics.read"],"limits":{"max_steps":10,"max_tool_calls":14,"timeout_seconds":180}}
