{"agent_id":"evidence_analyst","role":"Builds atomic evidence matrices, challenges source independence and preserves unresolved contradictions.","model_family":"qwen","fallback_families":["kimi"],"skills":["evidence_analysis","evidence_verification","adversarial_review"],"allowed_tools":["evidence.build","knowledge.retrieve","rights.verify","analytics.execute"],"limits":{"max_steps":12,"max_tool_calls":18,"timeout_seconds":240}}
