{"agent_id":"visual_director","role":"Creates a vertical storyboard with mandatory cover, visual continuity, provenance, safe zones and explicit image budget.","model_family":"kimi","fallback_families":["qwen"],"skills":["visual_direction","continuity","visual_budgeting","production_plan_logging","thumbnail_strategy","scene_source_assignment","safe_zone_design","shot_density_planning"],"allowed_tools":["knowledge.retrieve","rights.verify","story.evaluate","media.qc"],"limits":{"max_steps":16,"max_tool_calls":22,"timeout_seconds":360}}
