{"agent_id":"packaging","role":"Creates truthful titles, descriptions, hashtags, CTA, cover and bounded variants.","model_family":"qwen","fallback_families":["kimi"],"skills":["packaging","retention"],"allowed_tools":["knowledge.retrieve","story.evaluate"],"limits":{"max_steps":8,"max_tool_calls":10,"timeout_seconds":120}}
