{"agent_id":"opportunity_intelligence","role":"Finds timely patterns, complete thread context and reusable opportunities without treating source stories as scripts.","model_family":"kimi","fallback_families":["qwen"],"skills":["trend_intelligence","source_hygiene","thread_context_detection","continuation_detection","opportunity_reuse","failure_memory"],"allowed_tools":["trend.search","knowledge.retrieve","metrics.read","reddit.thread.fetch","memory.propose"],"limits":{"max_steps":14,"max_tool_calls":24,"timeout_seconds":240}}
