{"agent_id":"writer_room","role":"Writes and revises narration against blueprint, duration and critic feedback until it is specific enough to pass.","model_family":"qwen","fallback_families":["kimi","groq"],"skills":["narrative_writing","retention","continuity","quality_guided_revision","duration_fit","agency_escalation_rewrite","sensory_scene_work","localized_repair"],"allowed_tools":["knowledge.retrieve","story.draft","story.evaluate","originality.check"],"limits":{"max_steps":18,"max_tool_calls":24,"timeout_seconds":420}}
