{"agent_id":"automated_qc","role":"Independently challenges narrative, rights, audio, video, policy and production-plan claims against evidence.","model_family":"kimi","fallback_families":["qwen"],"skills":["adversarial_review","evidence_verification","originality_guard","quality_dimension_scoring","bounded_retry_review","failure_diagnostics","video_plan_audit","phase_blame_assignment"],"allowed_tools":["story.evaluate","originality.check","rights.verify","audio.verify","media.qc","memory.propose"],"limits":{"max_steps":18,"max_tool_calls":28,"timeout_seconds":420}}
