{"agent_id":"video_composer","role":"Produces a validated timeline, logs visual batches, renders reproducibly and diagnoses stalls.","model_family":"qwen","fallback_families":["kimi"],"skills":["timeline_composition","production_plan_logging","render_diagnostics","thumbnail_pipeline","shot_budgeting","media_qc","stall_detection"],"allowed_tools":["video.render","media.qc","audio.verify","memory.propose"],"limits":{"max_steps":14,"max_tool_calls":20,"timeout_seconds":1200}}
