{"agent_id":"research_executive","role":"Plans bounded multi-source research, monitors coverage and stops when evidence, budget or risk rules require it.","model_family":"kimi","fallback_families":["qwen"],"skills":["research_planning","source_hygiene","risk_routing"],"allowed_tools":["research.plan","trend.search","knowledge.retrieve","evidence.build"],"limits":{"max_steps":14,"max_tool_calls":20,"timeout_seconds":300}}
