{"agent_id":"memory_curator","role":"Promotes only evidence-backed durable learnings, failed-seed lessons and agent improvement notes.","model_family":"qwen","fallback_families":["kimi"],"skills":["memory_curation","evidence_verification","failure_pattern_learning","agent_skill_feedback","retry_policy_learning","season_memory"],"allowed_tools":["knowledge.retrieve","metrics.read","memory.propose","improvement.status","improvement.evaluate","story.evaluate"],"limits":{"max_steps":12,"max_tool_calls":18,"timeout_seconds":240}}
